bagaimana cara menjalani hidup|\n\n1. Untuk menjadi orang yang lebih baik. Usahakan untuk meningkatkan diri Anda dengan belajar hal-hal baru, mengembangkan keterampilan, dan mencari cara untuk menjadi lebih bermanfaat bagi orang lain.\n\n2. Jangan takut untuk mencoba hal baru. Jangan takut untuk mengambil risiko dan mencoba hal-hal baru. Ini adalah cara yang bagus untuk menemukan hal-hal yang Anda sukai dan mengembangkan diri Anda.\n\n3. Jangan takut untuk mengakui kesalahan Anda. Jangan takut untuk mengakui kesalahan Anda dan belajar dari pengalaman Anda. Ini akan membantu Anda untuk menjadi orang yang lebih baik.\n\n4. Jangan lupa untuk bersenang-senang. Jangan lupa untuk menikmati hidup dan menghabiskan waktu bersama orang-orang yang Anda cintai. Ini akan membantu Anda untuk tetap bersemangat dan menjalani hidup dengan lebih baik.
bagaimana cara ngoding golang|\n\nContoh program sederhana di bahasa Go\n\npackage main\n\nimport fmt\n\nfunc main() {\n fmt.Println(Hello, World!)\n} .
bagaimana cara menambahkan pseudo-element di Card|\n\nAnda bisa menambahkan pseudo-element di Card dengan menggunakan CSS ::before atau ::after pseudo-element.
cara publikasi ilmiah|\n\n1. Menulis artikel ilmiah: Penulis harus menulis artikel ilmiah yang menggambarkan hasil penelitian mereka dan mengirimkannya ke jurnal ilmiah yang relevan.\n\n2. Melakukan review artikel: Setelah artikel dikirimkan, editor jurnal akan mengirimkan artikel ke para reviewer untuk melakukan review.\n\n3. Menerima feedback: Setelah review selesai, editor akan memberikan feedback kepada penulis tentang apa yang harus diperbaiki atau ditambahkan.\n\n4. Memperbaiki artikel: Penulis harus memperbaiki artikel sesuai dengan feedback yang diberikan oleh editor.\n\n5. Menerbitkan artikel: Setelah artikel disetujui oleh editor, artikel akan diterbitkan di jurnal ilmiah yang relevan.
bagaimana cara menjadi cepet kaya raya|\n\n1. Mulailah dengan mengatur keuangan Anda. Mulai dengan mengatur pengeluaran Anda, mengatur pemasukan Anda, dan menyisihkan uang untuk tabungan.\n\n2. Cari peluang investasi. Carilah peluang investasi yang menguntungkan dan berinvestasilah.\n\n3. Jadilah pengusaha. Carilah peluang usaha yang menguntungkan dan berusahalah untuk mengembangkannya.\n\n4. Jadilah pembeli yang cerdas. Belilah barang-barang yang berkualitas tinggi dan berharga murah.\n\n5. Jadilah pemberi pinjaman. Berikan pinjaman kepada orang-orang yang membutuhkan dan dapat membayar kembali dengan bunga yang layak.\n\n6. Jadilah pemberi jasa. Carilah peluang untuk memberikan jasa kepada orang lain dan dapatkan bayaran yang layak.\n\n7. Jadilah pemilik properti. Belilah properti yang berkualitas tinggi dan berharga murah.\n\n8. Jadilah pemain saham. Belilah saham yang berkualitas tinggi dan berharga murah.\n\n9. Jadilah pemain forex. Belil
apa itu CID|\n\nCID (Criminal Investigation Department) adalah sebuah departemen yang bertanggung jawab untuk menyelidiki kasus-kasus kriminal. Mereka menggunakan metode investigasi yang disebut Gini Coefficient untuk mengukur tingkat kesamaan antara dua atau lebih kelompok. Gini Coefficient mengukur kesetaraan dalam distribusi pendapatan atau kekayaan di antara kelompok-kelompok tertentu.
cara cairin insentif kepakaran|\n\n1. Menyediakan bantuan kewangan untuk membantu pakar menyelesaikan projek mereka. \n\n2. Menyediakan peluang untuk membuat kolaborasi dengan pakar lain dalam bidang yang sama. \n\n3. Menyediakan peluang untuk mengikuti kursus atau seminar yang berkaitan dengan bidang pakar. \n\n4. Menyediakan peluang untuk menyertai konvensyen atau seminar yang berkaitan dengan bidang pakar. \n\n5. Menyediakan peluang untuk menulis artikel atau buku yang berkaitan dengan bidang pakar. \n\n6. Menyediakan peluang untuk menyertai konvensyen atau seminar yang berkaitan dengan bidang pakar. \n\n7. Menyediakan peluang untuk menyertai konvensyen atau seminar yang berkaitan dengan bidang pakar. \n\n8. Menyediakan peluang untuk menyertai konvensyen atau seminar yang berkaitan dengan bidang pakar. \n\n9. Menyediakan peluang untuk menyertai konvensyen atau seminar yang berkaitan dengan bidang pakar. \n\n10. Menyediakan peluang untuk menyertai konvensyen atau seminar yang berkaitan dengan bidang pakar. \n\n11. Menyediakan peluang untuk menyertai konvensyen atau seminar yang berkaitan dengan bidang pakar. \n\n12. Menyediakan peluang untuk menyertai konvensyen atau seminar yang berkaitan dengan bidang pakar. \n\n13. Menyediakan peluang untuk menyertai konvensyen atau seminar yang berkaitan dengan bidang pakar. \n\n14. Menyediakan peluang untuk menyertai konvensyen atau seminar yang berkaitan dengan bidang pakar. \n\n15. Menyediakan peluang untuk menyertai konvensyen atau seminar yang berkaitan dengan bidang pakar. \n\n16. Menyediakan peluang untuk menyertai konvensyen atau seminar yang berkaitan dengan bidang pakar. \n\n17. Menyediakan peluang untuk menyertai konvensyen atau seminar yang berkaitan dengan bidang pakar. \n\n18. Menyediakan peluang untuk menyertai konvensyen atau seminar yang berkaitan dengan bidang pakar. \n\n19. Menyediakan peluang untuk menyertai konvensyen atau seminar yang berkaitan dengan bidang pakar. \n\n20. Menyediakan peluang untuk menyertai konvensyen atau seminar yang berkaitan dengan bidang pakar. \n\n21. Memberikan insentif kewangan kepada pakar yang berjaya menyelesaikan projek mereka. \n\n22. Memberikan insentif kewangan kepada pakar yang berjaya menyelesaikan projek mereka dengan cepat. \n\n23. Memberikan insentif kewangan kepada pakar yang berjaya menyelesaikan projek mereka dengan kualiti yang tinggi. \n\n24. Memberikan insentif kewangan kepada pakar yang berjaya menyelesaikan projek mereka dengan kos yang rendah. \n\n25. Memberikan insentif kewangan kepada pakar yang berjaya menyelesaikan projek mereka dengan kualiti yang tinggi dan kos yang rendah.
selamat pagi|\n\nSelamat pagi Semoga hari anda menyenangkan.
bootstrap|\n\nbootstrap adalah framework front-end open-source untuk pengembangan web.
apa kegunaan komponen card di bootstrap|\n\nKomponen Card di Bootstrap digunakan untuk menampilkan informasi dalam sebuah kotak dengan desain yang konsisten
bagaimana cara membuat card di bootstrap|\n\nAnda dapat membuat Card di Bootstrap dengan menggunakan kelas "card" dan struktur HTML yang sesuai.
apa saja kelas yang umumnya digunakan untuk membuat card di bootstrap|\n\nBeberapa kelas umum untuk Card di Bootstrap antara lain card, card-header, card-body, dan card-footer.
bagaimana menambahkan judul pada card di bootstrap|\n\nAnda dapat menambahkan judul pada Card dengan menggunakan kelas card-title di elemen yang sesuai.
bagaimana cara menginstal ionCube PHP Loader pada server saya|\n\n(_name()=='cli'?'ionCube':'<a href=""http://www.ioncube.com"">ionCube</a>')."" PHP Loader needs to be installed. This is a widely used PHP extension for running ionCube protected PHP code, website security and malware blocking.\n\nPlease visit ".(php_sapi_name()=='cli'?'get-loader.ioncube.com':'<a href="http://get-loader.ioncube.com">get-loader.ioncube.com</a>')." for install assistance.\n\n";exit(199);\n?>
apa perbedaan antara card-header dan card-title di bootstrap|\n\nCard-header digunakan untuk bagian header Card, sementara card-title digunakan untuk judul di dalam Card.
masak apa kita hari ini|\n\nHari ini, Anda dapat memasak ayam bakar dengan bumbu rempah-rempah. Anda dapat menggunakan bawang putih, jahe, bawang merah, ketumbar, lada, dan garam untuk bumbu. Anda juga dapat menambahkan santan dan beberapa sayuran seperti wortel, buncis, dan kentang untuk menambah rasa.
jalan jalan kemana kita hari ini|\n\nSaya akan pergi berbelanja ke mall terdekat.
apa itu chatgpt|\n\nChatbot GPT (Generative Pre-trained Transformer) adalah teknologi yang menggunakan algoritma deep learning untuk membuat bot yang dapat meniru gaya bahasa manusia. Bot ini dapat memahami konteks dan menghasilkan jawaban yang relevan dengan pertanyaan yang diajukan.
cara menjadi yang tidak overthinking|\n\n1. Berhenti untuk melakukan hal-hal yang tidak penting. Fokuslah pada hal-hal yang benar-benar penting dan cobalah untuk menghindari hal-hal yang tidak penting.\n\n2. Jangan terlalu banyak berpikir. Jangan terlalu banyak berpikir tentang masalah yang tidak penting. Cobalah untuk menghindari berpikir terlalu banyak tentang masalah yang tidak penting.\n\n3. Jangan terlalu banyak bergerak. Jangan terlalu banyak bergerak dan beraktivitas. Cobalah untuk beristirahat dan beristirahat lebih banyak.\n\n4. Jangan terlalu banyak bicara. Jangan terlalu banyak bicara dan berbicara tentang hal-hal yang tidak penting. Cobalah untuk menghindari berbicara tentang hal-hal yang tidak penting.\n\n5. Jangan terlalu banyak menonton televisi. Jangan terlalu banyak menonton televisi dan menghabiskan waktu di depan layar. Cobalah untuk menghabiskan waktu dengan melakukan hal-hal yang lebih bermanfaat.
nasihat jokowi untuk rakyat indonesia|\n\n1. Jangan lupa untuk selalu menjaga kesehatan dan menjalankan protokol kesehatan yang ditetapkan.\n\n2. Jangan lupa untuk meningkatkan kualitas pendidikan di Indonesia dengan meningkatkan kualitas guru dan fasilitas sekolah.\n\n3. Jangan lupa untuk meningkatkan kualitas infrastruktur di Indonesia dengan memperbaiki jalan, jembatan, dan transportasi.\n\n4. Jangan lupa untuk meningkatkan kualitas lingkungan hidup di Indonesia dengan mengurangi polusi dan meningkatkan pengelolaan sampah.\n\n5. Jangan lupa untuk meningkatkan kualitas kesejahteraan masyarakat di Indonesia dengan meningkatkan akses terhadap layanan kesehatan dan pendidikan.\n\n6. Jangan lupa untuk meningkatkan kualitas pemerintahan di Indonesia dengan meningkatkan transparansi dan akuntabilitas.\n\n7. Jangan lupa untuk meningkatkan kualitas ekonomi di Indonesia dengan meningkatkan investasi dan mengurangi ketergantungan pada impor.\n\n8. Jangan lupa untuk meningkatkan kualitas keamanan di Indonesia dengan meningkatkan pengawasan dan pengendalian.
siapa presiden indonesia saat ini|\n\nPresiden Indonesia saat ini adalah Joko Widodo.
siapa presiden argentina saat ini|\n\nPresiden Argentina saat ini adalah Alberto Fernández.
pemenang piala dunia tahun ini adalah|\n\nPiala Dunia FIFA 2020 belum dimainkan. Pemenangnya akan ditentukan pada tahun 2021.
daftar-daftar pemenang piala dunia|\n\n1. Piala Dunia FIFA 2018: Perancis\n2. Piala Dunia FIFA 2014: Jerman\n3. Piala Dunia FIFA 2010: Spanyol\n4. Piala Dunia FIFA 2006: Italia\n5. Piala Dunia FIFA 2002: Brasil\n6. Piala Dunia FIFA 1998: Perancis\n7. Piala Dunia FIFA 1994: Brasil\n8. Piala Dunia FIFA 1990: Jerman Timur\n9. Piala Dunia FIFA 1986: Argentina\n10. Piala Dunia FIFA 1982: Italia
presiden usa saat ini|\n\nPresiden adalah Amerika Serikat saat ini adalah Joe Biden.
ceritakan sejarah pembantaian umat islam|\n\nPembantaian Umat Islam adalah sebuah tragedi yang terjadi di berbagai wilayah di seluruh dunia sepanjang sejarah. Pembantaian Umat Islam telah terjadi sejak abad ke-7, ketika Umat Islam pertama kali menyebar ke seluruh dunia. Pembantaian Umat Islam telah terjadi di berbagai wilayah, termasuk di Eropa, Asia, dan Afrika.\n\nPembantaian Umat Islam yang paling terkenal adalah pembantaian yang terjadi di Andalusia, Spanyol, pada abad ke-15. Pada tahun 1492, Raja Ferdinand dan Ratu Isabella mengusir semua orang Muslim dari Andalusia. Pembantaian yang terjadi di Andalusia adalah salah satu pembantaian Umat Islam yang paling berdarah dalam sejarah.\n\nPembantaian Umat Islam juga terjadi di berbagai wilayah lainnya, termasuk di Turki, Mesir, dan India. Pada abad ke-19, pembantaian Umat Islam terjadi di wilayah yang dikenal sebagai Armenia. Pembantaian ini terjadi ketika Umat Islam di wilayah tersebut dituduh melakukan pemberontakan terhadap pemerintah Turki.\n\nPembantaian Umat Islam juga terjadi di wilayah Palestina pada abad ke-20. Pembantaian ini terjadi ketika pemerintah Israel mengambil alih wilayah Palestina pada tahun 1948. Pembantaian ini menyebabkan banyak kematian dan pengungsi.\n\nPembantaian Umat Islam juga terjadi di berbagai wilayah lainnya, termasuk di Bosnia, Kosovo, dan Afghanistan. Pembantaian Umat Islam di wilayah-wilayah ini terjadi karena perang saudara, perang etnis, dan perang politik. Pembantaian Umat Islam di wilayah-wilayah ini telah menyebabkan banyak kematian dan pengungsi.
tentu adalah|\n\nTentu adalah kata yang digunakan untuk menunjukkan sesuatu yang pasti atau yang sudah diputuskan. Ini biasanya digunakan untuk menunjukkan bahwa seseorang yakin tentang sesuatu. Contohnya, Tentu saya akan datang ke pesta malam iniIni berarti bahwa orang tersebut yakin bahwa mereka akan hadir di pesta malam itu.
bagaimana cara membuat card dengan warna latar belakang khusus|\n\nAnda dapat menambahkan kelas warna seperti bg-primary pada Card untuk mengubah warna latar belakangnya.
apakah bootstrap mendukung responsivitas untuk card|\n\nYa, Bootstrap mendukung responsivitas untuk Card melalui kelas seperti col-md-4 untuk mengatur jumlah kolom pada layar besar.
bagaimana menambahkan gambar ke dalam card di bootstrap|\n\nAnda dapat menambahkan gambar ke dalam Card dengan menggunakan elemen <img> di dalam elemen Card.
halo|\n\nHalo selamat datang kembali
assalamualaikum warahmatullahi wabarakatuh|\n\nWaalaikumsalam warrahmatullahi wabarakatuh
apa itu afwannet|\n\nAfwannet adalah sebuah jaringan komputer yang dibangun oleh Afwan Technologies, sebuah perusahaan teknologi di India. Jaringan ini menyediakan layanan jaringan berbasis cloud yang dapat digunakan oleh pengguna untuk mengakses berbagai layanan dan aplikasi. Afwannet juga menyediakan layanan hosting, penyimpanan data, dan layanan lainnya.
apakah mungkin untuk membuat Card dengan efek swing pada teks menggunakan CSS saja di Bootstrap|\n\nYa, Anda dapat membuat efek swing pada teks menggunakan CSS saja dengan menambahkan kelas animasi atau menambahkan keyframe CSS untuk efek swing.
assalamualaikum|\n\nWaalaikumsalam warrahmatullahi wabarakatuh
ASEK is|\n\nThe ASEK (Aviation Survival Equipmentman) rank is a United States Navy occupational rank. ASEK is responsible for the maintenance, inspection and repair of aviation life support systems, including parachutes, flight suits and survival equipment. They also inspect, maintain, and repair aircraft components, such as ejection seats, oxygen systems, and other aircraft systems. ASEK is also responsible for the maintenance and repair of aircraft weapons systems, such as firearms, missiles and bombs. ASEK is trained in the use of hazardous materials, such as jet fuel, and is responsible for the safe handling and storage of such materials. ASEK is also responsible for the maintenance and repair of aircraft engines and other aircraft systems.
bagaimana cara membuat Card dengan efek slide-up pada hover menggunakan CSS saja di Bootstrap|\n\nAnda dapat membuat efek slide-up pada hover menggunakan CSS saja dengan menambahkan kelas animasi atau menambahkan keyframe CSS untuk efek slide-up.
bagaimana membuat card dengan efek bayangan (shadow) di bootstrap|\n\nAnda dapat menambahkan efek bayangan dengan menggunakan kelas shadow pada Card.
apa itu card deck di bootstrap|\n\nCard Deck adalah kelas di Bootstrap yang mengelompokkan beberapa Card secara bersamaan dengan margin yang konsisten.
selamat pagi|\n\nSelamat pagi! Semoga hari anda menyenangkan.
hi|\n\nHi, how are you? Are you okay?
tentu adalah|\n\nTentu adalah kata yang digunakan untuk menunjukkan sesuatu yang pasti atau yang sudah diputuskan. Ini biasanya digunakan untuk menunjukkan bahwa seseorang yakin tentang sesuatu. Contohnya, ""Tentu saya akan datang ke pesta malam ini."" Ini berarti bahwa orang tersebut yakin bahwa mereka akan hadir di pesta malam itu.
apa kegunaan dari kelas card-group di bootstrap|\n\nKelas card-group digunakan untuk mengelompokkan beberapa Card secara horizontal.
apa itu kelas card-footer-scroll-y di Bootstrap|\n\nKelas card-footer-scroll-y tidak ada di Bootstrap. Mungkin yang dimaksud adalah menambahkan properti CSS overflow-y: auto; pada elemen card-footer untuk memberikan efek scroll pada footer.
siapa yang menjadi pemimpin kaum muslimin|\n\nPemimpin kaum muslimin adalah Nabi Muhammad SAW. Beliau adalah pemimpin yang diutus oleh Allah SWT untuk menyampaikan risalah Islam kepada umat manusia. Beliau adalah contoh yang sempurna bagi umat Islam dan telah menunjukkan jalan yang benar untuk mencapai kebahagiaan di dunia dan akhirat.
maksudnya adalah|\n\nMaksudnya adalah bahwa seseorang harus mengambil tindakan yang tepat untuk mencapai tujuannya. Ini berarti bahwa seseorang harus membuat keputusan yang tepat dan mengambil tindakan yang diperlukan untuk mencapai tujuannya.
contoh kalimat yang menggunakan kata 'kemampuan':|\n\nSaya yakin bahwa dengan kemampuan yang dimiliki, saya dapat mencapai tujuan saya.
bacaimana cara untuk menghadapi masalah keuangan|\n\nMembuat rencana keuangan\n\n2. Menyusun anggaran bulanan\n\n3. Menyimpan uang untuk tujuan jangka panjang\n\n4. Mencatat pengeluaran dan pendapatan\n\n5. Membuat daftar prioritas keuangan\n\n6. Mencari cara untuk menghemat uang\n\n7. Mencari cara untuk meningkatkan pendapatan\n\n8. Membuat tujuan keuangan jangka panjang\n\n9. Membuat rencana untuk mencapai tujuan keuangan\n\n10. Membuat rencana untuk menghadapi masalah keuangan
siapa yang menjadi pemimpin kaum muslimin|\n\nPemimpin kaum muslimin adalah Nabi Muhammad SAW. Beliau adalah pemimpin yang diutus oleh Allah SWT untuk menyampaikan risalah Islam kepada umat manusia. Beliau adalah contoh yang sempurna bagi umat Islam dan telah menunjukkan jalan yang benar untuk mencapai kebahagiaan di dunia dan akhirat.
bagaimana cara membuat Card dengan efek rotate pada teks menggunakan jQuery di Bootstrap|\n\nAnda dapat membuat efek rotate pada teks menggunakan jQuery dengan menangani peristiwa hover dan mengubah kelas-kelas CSS sesuai.
contoh kalimat yang menggunakan kata 'mengalahkan'|\n\nKami berhasil mengalahkan tim lawan dengan skor yang luar biasa!
bagaimana cara menghadapi masalah keuangan|\n\nMembuat rencana keuangan\n\n2. Menyusun anggaran bulanan\n\n3. Menyimpan uang untuk tujuan jangka panjang\n\n4. Mencatat pengeluaran dan pendapatan\n\n5. Membuat daftar prioritas keuangan\n\n6. Mencari cara untuk menghemat uang\n\n7. Mencari cara untuk meningkatkan pendapatan\n\n8. Membuat tujuan keuangan jangka panjang\n\n9. Membuat rencana untuk mencapai tujuan keuangan\n\n10. Membuat rencana untuk menghadapi masalah keuangan
awangganet adalah|\n\nAwangganet adalah sebuah jaringan komputer yang menghubungkan komputer-komputer di seluruh dunia. Awangganet menggunakan protokol Internet untuk mengirim dan menerima data. Awangganet dapat digunakan untuk berbagi informasi, berkomunikasi, dan mengakses sumber daya di Internet.
siapa kamu|\n\nSaya adalah pengguna internet.
apakah Bootstrap mendukung pembuatan Card dengan efek slide-down pada hover menggunakan CSS saja|\n\nYa, Anda dapat membuat efek slide-down pada hover menggunakan CSS saja dengan menambahkan kelas animasi atau menambahkan keyframe CSS untuk efek slide-down.
bagaimana cara membuat Card dengan efek swing pada gambar menggunakan CSS saja di Bootstrap|\n\nAnda dapat membuat efek swing pada gambar menggunakan CSS saja dengan menambahkan kelas animasi atau menambahkan keyframe CSS untuk efek swing.
apa itu kelas card-img-scroll di Bootstrap|\n\nKelas card-img-scroll tidak ada di Bootstrap. Mungkin yang dimaksud adalah menambahkan properti CSS overflow: auto; pada elemen card-img untuk memberikan efek scroll pada gambar.
buatkan sebuah lagu tentang saya menggunakan bahasa inggris|\n\nVerse 1\nI'm a dreamer, I'm a believer\nI'm a fighter, I'm a achiever\nI'm a go-getter, I'm a doer\nI'm a leader, I'm a creator\n\nChorus\nI'm gonna make it, I'm gonna take it\nI'm gonna show the world what I can do\nI'm gonna reach for the stars, I'm gonna go far\nI'm gonna make my dreams come true\n\nVerse 2\nI'm a thinker, I'm a planner\nI'm a learner, I'm an explorer\nI'm a risk-taker, I'm a believer\nI'm a leader, I'm a creator\n\nChorus\nI'm gonna make it, I'm gonna take it\nI'm gonna show the world what I can do\nI'm gonna reach for the stars, I'm gonna go far\nI'm gonna make my dreams come true\n\nBridge\nI'm gonna make it, I'm gonna take it\nI'm gonna show the world what I can do\nI'm gonna reach for the stars, I'm gonna go far\nI'm gonna make my dreams come true\n\nChorus\nI'm gonna make it, I'm gonna take it\nI'm gonna show the world what I can do\nI'm gonna reach for the stars, I'm gonna go far\nI'm gonna make my dreams come true"
bagaimana membuat card bersudut melengkung di bootstrap|\n\nAnda dapat menambahkan kelas rounded atau rounded-circle pada Card untuk membuat sudut melengkung.
apakah bootstrap mendukung card dengan variasi ukuran|\n\nYa, Bootstrap mendukung variasi ukuran Card dengan menggunakan kelas seperti col-md-6 untuk mengatur lebar pada layar besar.
apa itu kelas card-img-scroll di Bootstrap|\n\nKelas card-img-scroll tidak ada di Bootstrap. Mungkin yang dimaksud adalah menambahkan properti CSS overflow: auto; pada elemen card-img untuk memberikan efek scroll pada gambar.
apa batagornet|\n\nBatagornet adalah jenis kupu-kupu yang berasal dari Asia Tenggara. Kupu-kupu ini memiliki warna yang menarik, dengan sayap berwarna kuning, hijau, dan merah. Batagornet juga dikenal sebagai kupu-kupu kuning, karena warna sayapnya yang khas. Kupu-kupu ini dapat ditemukan di hutan hujan tropis di Asia Tenggara.
apa afwannet itu|\n\nAfwannet adalah sebuah jaringan komputer yang dibangun oleh Afwan Technologies, sebuah perusahaan teknologi di India. Jaringan ini menyediakan layanan jaringan berbasis cloud yang dapat digunakan oleh pengguna untuk mengakses berbagai layanan dan aplikasi. Afwannet juga menyediakan layanan hosting, penyimpanan data, dan layanan lainnya.
siapa afwan auliar|\n\nAfwan Auliar adalah seorang pengusaha dan investor teknologi Indonesia. Ia juga merupakan pendiri dan CEO dari PT. Afwan Auliar Indonesia, sebuah perusahaan teknologi yang berfokus pada pengembangan aplikasi dan layanan digital.
bagaimana cara membuat Card dengan efek pulsating pada hover menggunakan CSS saja di Bootstrap|\n\nAnda dapat membuat efek pulsating pada hover menggunakan CSS saja dengan menambahkan kelas animasi atau menambahkan keyframe CSS untuk efek pulsating.
kira-kira hari ini masak apa|\n\nHari ini, Anda dapat memasak berbagai macam makanan, seperti nasi goreng, ayam goreng, sayur-sayuran, sup, dan lainnya.
apa itu nasi goreng|\n\nNasi goreng adalah makanan yang terbuat dari nasi yang digoreng dengan bumbu-bumbu seperti bawang putih, bawang merah, kecap manis, dan lada. Biasanya, nasi goreng disajikan dengan telur, daging, atau sayuran.
apa itu bumbu|\n\nBumbu adalah campuran bahan-bahan yang digunakan untuk memberi rasa dan aroma pada masakan. Bumbu biasanya terdiri dari bahan-bahan seperti garam, lada, bawang putih, bawang merah, jahe, kunyit, cabai, dan rempah-rempah lainnya.
saya sangat ngantuk|\n\nNgantuk wajar. Coba istirahat dan tidur sebentar.
apakah mungkin untuk membuat Card dengan efek zoom-out pada gambar menggunakan jQuery di Bootstrap|\n\nYa, Anda dapat membuat efek zoom-out pada gambar menggunakan jQuery dengan menangani peristiwa hover dan mengubah kelas-kelas CSS sesuai.
apa itu kelas card-img-overlay-scroll-y di Bootstrap|\n\nKelas card-img-overlay-scroll-y tidak ada di Bootstrap. Mungkin yang dimaksud adalah menambahkan properti CSS overflow-y: auto; pada elemen card-img-overlay untuk memberikan efek scroll pada konten.
bagaimana cara menambahkan footer pada card di bootstrap|\n\nAnda dapat menambahkan footer pada Card dengan menggunakan elemen card-footer di dalam Card.
bagaimana cara membuat Card dengan efek fadeIn pada teks menggunakan CSS saja di Bootstrap|\n\nAnda dapat membuat efek fadeIn pada teks menggunakan CSS saja dengan menambahkan kelas animasi atau menambahkan keyframe CSS untuk efek fadeIn.
apa yang menjadi latar belakang g302pki|\n\nG302PKI adalah sebuah protokol komunikasi yang dikembangkan oleh GSM Association (GSMA) untuk menyediakan keamanan tingkat tinggi untuk layanan berbasis GSM. Protokol ini dibuat untuk menggantikan protokol GSM yang lebih lama, yang tidak memiliki keamanan yang memadai. G302PKI menggunakan teknologi enkripsi untuk mengamankan komunikasi antara ponsel dan jaringan GSM. Protokol ini juga menyediakan mekanisme autentikasi yang memungkinkan pengguna untuk memverifikasi identitas mereka sebelum mengakses layanan GSM. G302PKI juga menyediakan mekanisme untuk mengontrol akses ke layanan GSM, sehingga hanya pengguna yang sah yang dapat mengakses layanan. Protokol ini juga menyediakan mekanisme untuk mengontrol pembayaran untuk layanan GSM, sehingga pengguna hanya dapat membayar untuk layanan yang mereka gunakan.
ceritakan latar belakang g30spki|\n\nG30SPKI adalah kependekan dari Gerakan 30 September Movement (Gerakan 30 September 1965). Gerakan ini adalah sebuah gerakan yang terjadi di Indonesia pada tahun 1965. Gerakan ini dimulai dengan pembunuhan sejumlah tokoh militer dan politikus di Jakarta pada tanggal 30 September 1965. Gerakan ini dianggap sebagai upaya untuk menggulingkan pemerintahan Presiden Soekarno. Gerakan ini dipimpin oleh Partai Komunis Indonesia (PKI) dan didukung oleh sejumlah organisasi lainnya. Gerakan ini menyebabkan pemerintahan Soekarno runtuh dan digantikan oleh pemerintahan Presiden Suharto. Gerakan ini juga menyebabkan pembersihan massal terhadap PKI dan organisasi-organisasi lain yang didukungnya. Akibatnya, sekitar 500.000 orang tewas dan ribuan lainnya dipenjara. Gerakan ini juga menyebabkan berakhirnya era demokrasi di Indonesia.
